{
  "$schema": "https://json-schema.org/draft/2020-12/schema",
  "$id": "urn:pdp-connect:data-connectors:scope-catalog:1.0.0",
  "title": "PDP-Connect public source and scope catalog",
  "type": "object",
  "required": ["catalogSchema", "distribution", "catalogVersion", "generatedBy", "generatedFrom", "scopes"],
  "properties": {
    "catalogSchema": {
      "type": "object",
      "required": ["path", "releaseAsset"],
      "properties": {
        "path": { "const": "schemas/scope-catalog.schema.json" },
        "releaseAsset": { "const": "scope-catalog.schema.json" }
      },
      "additionalProperties": false
    },
    "catalogVersion": { "type": "string", "pattern": "^[0-9]+\\.[0-9]+\\.[0-9]+$" },
    "distribution": {
      "type": "object",
      "required": ["repository"],
      "properties": {
        "repository": { "const": "https://github.com/PDP-Connect/data-connectors" },
        "sourceCommit": { "type": "string", "pattern": "^[0-9a-f]{40}$" },
        "releaseTag": { "type": "string", "pattern": "^connectors-[0-9a-f]{12}$" }
      },
      "dependentRequired": {
        "sourceCommit": ["releaseTag"],
        "releaseTag": ["sourceCommit"]
      },
      "additionalProperties": false
    },
    "generatedBy": { "const": "scripts/generate-scope-catalog.mjs" },
    "generatedFrom": {
      "type": "object",
      "required": ["publishability", "manifests"],
      "properties": {
        "publishability": {
          "type": "object",
          "required": ["path", "manifestSelector"],
          "properties": {
            "path": { "const": "registry.json" },
            "manifestSelector": { "const": "connectors[].files.metadata" }
          },
          "additionalProperties": false
        },
        "manifests": {
          "type": "array",
          "description": "Manifests the catalog was generated from, as listed by registry.json. Any connector manifest under connectors/ qualifies; the filename does not encode the runtime (a manifest may declare playwright, vanilla, or network-capture).",
          "items": { "type": "string", "pattern": "^connectors/.+\\.json$" },
          "uniqueItems": true
        }
      },
      "additionalProperties": false
    },
    "scopes": {
      "type": "array",
      "items": { "$ref": "#/$defs/scope" }
    }
  },
  "$defs": {
    "connector": {
      "type": "object",
      "required": ["id", "status"],
      "properties": {
        "id": { "type": "string", "minLength": 1 },
        "status": { "type": "string", "enum": ["stable", "beta", "experimental"] },
        "limits": {
          "type": "array",
          "minItems": 1,
          "items": { "$ref": "#/$defs/limit" }
        }
      },
      "additionalProperties": false
    },
    "limit": {
      "type": "object",
      "required": ["type", "value", "unit", "description"],
      "properties": {
        "type": { "type": "string", "enum": ["maxItems", "timeWindow"] },
        "value": { "type": "integer", "minimum": 1 },
        "unit": { "type": "string", "minLength": 1 },
        "description": { "type": "string", "minLength": 1 }
      },
      "additionalProperties": false
    },
    "scope": {
      "type": "object",
      "required": ["sourceId", "scopeId", "description", "schema", "maturity", "fulfillment"],
      "properties": {
        "sourceId": { "type": "string", "pattern": "^[a-z0-9_-]+$" },
        "scopeId": { "type": "string", "pattern": "^[a-z0-9_-]+\\.[A-Za-z0-9_.-]+$" },
        "description": { "type": "string", "minLength": 1 },
        "schema": {
          "type": "object",
          "required": ["path"],
          "properties": {
            "path": { "type": "string", "pattern": "^connectors/.+/schemas/.+\\.json$" },
            "url": { "type": "string", "pattern": "^https://raw\\.githubusercontent\\.com/PDP-Connect/data-connectors/[0-9a-f]{40}/connectors/.+/schemas/.+\\.json$" }
          },
          "additionalProperties": false
        },
        "maturity": { "type": "string", "enum": ["stable", "beta", "experimental"] },
        "fulfillment": {
          "type": "object",
          "required": ["desktop"],
          "properties": {
            "desktop": {
              "type": "object",
              "required": ["status", "connectors"],
              "properties": {
                "status": { "const": "supported" },
                "connectors": {
                  "type": "array",
                  "minItems": 1,
                  "items": { "$ref": "#/$defs/connector" },
                  "uniqueItems": true
                }
              },
              "additionalProperties": false
            }
          },
          "additionalProperties": false
        }
      },
      "additionalProperties": false
    }
  },
  "allOf": [
    {
      "if": {
        "properties": {
          "distribution": {
            "type": "object",
            "properties": {
              "sourceCommit": { "type": "string" }
            },
            "required": ["sourceCommit"]
          }
        },
        "required": ["distribution"]
      },
      "then": {
        "properties": {
          "scopes": {
            "type": "array",
            "items": {
              "type": "object",
              "properties": {
                "schema": {
                  "type": "object",
                  "properties": {
                    "url": { "type": "string" }
                  },
                  "required": ["url"]
                }
              }
            }
          }
        }
      }
    }
  ],
  "additionalProperties": false
}
