{
  "catalogSchema": {
    "path": "schemas/scope-catalog.schema.json",
    "releaseAsset": "scope-catalog.schema.json"
  },
  "distribution": {
    "repository": "https://github.com/PDP-Connect/data-connectors"
  },
  "catalogVersion": "1.0.0",
  "generatedBy": "scripts/generate-scope-catalog.mjs",
  "generatedFrom": {
    "publishability": {
      "path": "registry.json",
      "manifestSelector": "connectors[].files.metadata"
    },
    "manifests": [
      "connectors/amazon/amazon-playwright.json",
      "connectors/anthropic/claude-code-local.json",
      "connectors/anthropic/claude-export-playwright.json",
      "connectors/apple/icloud-notes-playwright.json",
      "connectors/doordash/doordash-playwright.json",
      "connectors/github/github-playwright.json",
      "connectors/google/youtube-playwright.json",
      "connectors/heb/heb-playwright.json",
      "connectors/linkedin/linkedin-playwright.json",
      "connectors/meta/instagram-ads-playwright.json",
      "connectors/meta/instagram-playwright.json",
      "connectors/openai/chatgpt-playwright.json",
      "connectors/oura/oura-playwright.json",
      "connectors/shopify/shop-playwright.json",
      "connectors/spotify/spotify-playwright.json",
      "connectors/uber/uber-playwright.json",
      "connectors/valve/steam-playwright.json",
      "connectors/wholefoods/wholefoods-playwright.json"
    ]
  },
  "scopes": [
    {
      "sourceId": "amazon",
      "scopeId": "amazon.orders",
      "description": "Order history including items, prices, dates, and delivery status",
      "schema": {
        "path": "connectors/amazon/schemas/amazon.orders.json"
      },
      "maturity": "beta",
      "fulfillment": {
        "desktop": {
          "status": "supported",
          "connectors": [
            {
              "id": "amazon-playwright",
              "status": "beta"
            }
          ]
        }
      }
    },
    {
      "sourceId": "amazon",
      "scopeId": "amazon.profile",
      "description": "Account name and Prime membership status",
      "schema": {
        "path": "connectors/amazon/schemas/amazon.profile.json"
      },
      "maturity": "beta",
      "fulfillment": {
        "desktop": {
          "status": "supported",
          "connectors": [
            {
              "id": "amazon-playwright",
              "status": "beta"
            }
          ]
        }
      }
    },
    {
      "sourceId": "chatgpt",
      "scopeId": "chatgpt.conversations",
      "description": "All conversation history including messages with ChatGPT",
      "schema": {
        "path": "connectors/openai/schemas/chatgpt.conversations.json"
      },
      "maturity": "stable",
      "fulfillment": {
        "desktop": {
          "status": "supported",
          "connectors": [
            {
              "id": "chatgpt-playwright",
              "status": "stable"
            }
          ]
        }
      }
    },
    {
      "sourceId": "chatgpt",
      "scopeId": "chatgpt.memories",
      "description": "Saved memories that ChatGPT uses to personalize responses",
      "schema": {
        "path": "connectors/openai/schemas/chatgpt.memories.json"
      },
      "maturity": "stable",
      "fulfillment": {
        "desktop": {
          "status": "supported",
          "connectors": [
            {
              "id": "chatgpt-playwright",
              "status": "stable"
            }
          ]
        }
      }
    },
    {
      "sourceId": "claude_code",
      "scopeId": "claude_code.prompts",
      "description": "The prompts you typed into Claude Code, with timestamp and project, derived from your local command history. Pasted attachment bodies are excluded.",
      "schema": {
        "path": "connectors/anthropic/schemas/claude_code.prompts.json"
      },
      "maturity": "experimental",
      "fulfillment": {
        "desktop": {
          "status": "supported",
          "connectors": [
            {
              "id": "claude-code-local",
              "status": "experimental"
            }
          ]
        }
      }
    },
    {
      "sourceId": "claude_code",
      "scopeId": "claude_code.sessions",
      "description": "Per-session metadata across all of your Claude Code projects: project path, git branch, CLI version, start/end time, message counts, models used, and the session title. Message bodies are not exported.",
      "schema": {
        "path": "connectors/anthropic/schemas/claude_code.sessions.json"
      },
      "maturity": "experimental",
      "fulfillment": {
        "desktop": {
          "status": "supported",
          "connectors": [
            {
              "id": "claude-code-local",
              "status": "experimental"
            }
          ]
        }
      }
    },
    {
      "sourceId": "claude_code",
      "scopeId": "claude_code.trajectories",
      "description": "The full step-by-step trace of each Claude Code session: your prompts, the assistant's reasoning and replies, every tool call with its input, and every tool result with its output, in order. This includes source code, file paths, and command output from your machine. Credential-shaped strings are redacted and long step bodies are truncated.",
      "schema": {
        "path": "connectors/anthropic/schemas/claude_code.trajectories.json"
      },
      "maturity": "experimental",
      "fulfillment": {
        "desktop": {
          "status": "supported",
          "connectors": [
            {
              "id": "claude-code-local",
              "status": "experimental"
            }
          ]
        }
      }
    },
    {
      "sourceId": "claude_code",
      "scopeId": "claude_code.usage",
      "description": "Aggregate Claude Code usage: total sessions and messages, per-model token consumption and cost, day-by-day activity, hour-of-day distribution, and your longest session.",
      "schema": {
        "path": "connectors/anthropic/schemas/claude_code.usage.json"
      },
      "maturity": "experimental",
      "fulfillment": {
        "desktop": {
          "status": "supported",
          "connectors": [
            {
              "id": "claude-code-local",
              "status": "experimental"
            }
          ]
        }
      }
    },
    {
      "sourceId": "claude",
      "scopeId": "claude.conversations",
      "description": "All Claude conversations with full message threads, from Anthropic's official data export.",
      "schema": {
        "path": "connectors/anthropic/schemas/claude.conversations.json"
      },
      "maturity": "experimental",
      "fulfillment": {
        "desktop": {
          "status": "supported",
          "connectors": [
            {
              "id": "claude-export-playwright",
              "status": "experimental"
            }
          ]
        }
      }
    },
    {
      "sourceId": "claude",
      "scopeId": "claude.projects",
      "description": "Claude projects and their detail, from Anthropic's official data export.",
      "schema": {
        "path": "connectors/anthropic/schemas/claude.projects.json"
      },
      "maturity": "experimental",
      "fulfillment": {
        "desktop": {
          "status": "supported",
          "connectors": [
            {
              "id": "claude-export-playwright",
              "status": "experimental"
            }
          ]
        }
      }
    },
    {
      "sourceId": "doordash",
      "scopeId": "doordash.orders",
      "description": "Complete order history with restaurant names, items ordered, dates, totals, and delivery status",
      "schema": {
        "path": "connectors/doordash/schemas/doordash.orders.json"
      },
      "maturity": "beta",
      "fulfillment": {
        "desktop": {
          "status": "supported",
          "connectors": [
            {
              "id": "doordash-playwright",
              "status": "beta"
            }
          ]
        }
      }
    },
    {
      "sourceId": "github",
      "scopeId": "github.contributions",
      "description": "Daily contribution counts for the last 4 years (per-year scrape, not just rolling 12 months), monthly totals, per-year totals, and your top day",
      "schema": {
        "path": "connectors/github/schemas/github.contributions.json"
      },
      "maturity": "stable",
      "fulfillment": {
        "desktop": {
          "status": "supported",
          "connectors": [
            {
              "id": "github-playwright",
              "status": "stable",
              "limits": [
                {
                  "type": "timeWindow",
                  "value": 4,
                  "unit": "years",
                  "description": "The Desktop connector collects the four most recent calendar years."
                }
              ]
            }
          ]
        }
      }
    },
    {
      "sourceId": "github",
      "scopeId": "github.events",
      "description": "Recent public activity (pushes, pull requests, issues, comments, branches, releases) across every repository you have touched, including organization-owned repos",
      "schema": {
        "path": "connectors/github/schemas/github.events.json"
      },
      "maturity": "stable",
      "fulfillment": {
        "desktop": {
          "status": "supported",
          "connectors": [
            {
              "id": "github-playwright",
              "status": "stable",
              "limits": [
                {
                  "type": "maxItems",
                  "value": 300,
                  "unit": "events",
                  "description": "The Desktop connector returns at most 300 public events."
                },
                {
                  "type": "timeWindow",
                  "value": 90,
                  "unit": "days",
                  "description": "The GitHub public-events API covers at most the previous 90 days."
                }
              ]
            }
          ]
        }
      }
    },
    {